text,top_class,hate_speech,offensive_language,neither
shroud3,neither,0.03945320844208391,0.33037608806864915,0.630170703489267
Check out Mike's other channel for more streams and more emotes shroudyH https://www.twitch.tv/shroudplaysothergames,neither,0.03603840260309928,0.2981352578286489,0.6658263395682519
shroudY shroudOverit shroudY shroudY shroudY shroudY shroudY,neither,0.03945320844208391,0.33037608806864915,0.630170703489267
shroudY shroudY shroudY shroudY shroudY shroudY shroudY shroudY shroudY shroudY shroudY,neither,0.03945320844208391,0.33037608806864915,0.630170703489267
shroudHello shroudHello shroudHello shroudHello shroudHello shroudHello shroudHello shroudHello shroudHello shroudHello,neither,0.03945320844208391,0.33037608806864915,0.630170703489267
FBPass shroudPigeon FBBlock shroud4Head FBPass shroudPigeon FBBlock shroud4Head FBPass shroudPigeon FBBlock shroud4Head,neither,0.03945320844208391,0.33037608806864915,0.630170703489267
shroudHyper shroudHyper shroudHyper shroudHyper,neither,0.03945320844208391,0.33037608806864915,0.630170703489267
shroudR shroudR shroudR shroudR shroudR,neither,0.03945320844208391,0.33037608806864915,0.630170703489267
dinkRip dinkRip dinkRip dinkRip dinkRip dinkRip dinkRip dinkRip,neither,0.03945320844208391,0.33037608806864915,0.630170703489267
shroud200 Kappa,neither,0.03945320844208391,0.33037608806864915,0.630170703489267
shroudHello shroudHello shroudHello shroudHello shroudHello,neither,0.03945320844208391,0.33037608806864915,0.630170703489267
shroudY shroudY shroudY shroudY shroudY shroudY shroudY,neither,0.03945320844208391,0.33037608806864915,0.630170703489267
shroudY shroudY shroudY shroudY shroudY shroudY shroudY shroudY shroudY shroudY,neither,0.03945320844208391,0.33037608806864915,0.630170703489267
shroudOverit shroudY shroudY shroudY shroudY shroudY,neither,0.03945320844208391,0.33037608806864915,0.630170703489267
shroudHmm shroudHmm shroudHmm shroudHmm shroudHmm shroudHmm shroudHmm shroudHmm shroudHmm shroudHmm shroudHmm shroudHmm shroudHmm,neither,0.03945320844208391,0.33037608806864915,0.630170703489267
shroudPalm shroudPalm shroudPalm shroudPalm shroudPalm shroudPalm shroudPalm shroudPalm,neither,0.03945320844208391,0.33037608806864915,0.630170703489267
musF musF musF musF musF musF,neither,0.03945320844208391,0.33037608806864915,0.630170703489267
shroudInsane shroudInsane shroudInsane shroudInsane shroudInsane,neither,0.03945320844208391,0.33037608806864915,0.630170703489267
shroudHello shroudHello shroudHello shroudHello shroudHello,neither,0.03945320844208391,0.33037608806864915,0.630170703489267
nymnOkay,neither,0.03945320844208391,0.33037608806864915,0.630170703489267
shroud4Head shroud4Head shroud4Head shroud4Head shroud4Head shroud4Head,neither,0.03945320844208391,0.33037608806864915,0.630170703489267
shroudDad shroudDad shroudDad shroudPigeon shroudDinner shroudDinner shroudDinner shroudDinner shroudDinner,neither,0.03945320844208391,0.33037608806864915,0.630170703489267
shroudHello shroudHello shroudHello shroudHello shroudHello shroudHello shroudHello shroudHello shroudHello shroudHello shroudHello shroudHello shroudHello shroudHello shroudHello,neither,0.03945320844208391,0.33037608806864915,0.630170703489267
shroudCrash shroud4Head shroudCrash shroud4Head shroudCrash shroud4Head shroud4Head shroud4Head shroud4Head shroud4Head shroud4Head,neither,0.03945320844208391,0.33037608806864915,0.630170703489267
shroudHello shroudHello shroudHello shroudHello shroudHello,neither,0.03945320844208391,0.33037608806864915,0.630170703489267
shroudR shroudR shroudR shroudR shroudR shroudR shroudR,neither,0.03945320844208391,0.33037608806864915,0.630170703489267
shroudHyper shroudHyper shroudHyper,neither,0.03945320844208391,0.33037608806864915,0.630170703489267
shroudThump shroudThump shroudThump shroudThump shroudThump shroudThump shroudThump shroudThump,neither,0.03945320844208391,0.33037608806864915,0.630170703489267
shroudFists shroudFists shroudFists shroudFists shroudFists shroudFists shroudFists shroudFists,neither,0.03945320844208391,0.33037608806864915,0.630170703489267
shroudHmm shroudHmm shroudHmm shroudHmm shroudHmm shroudHmm shroudHmm shroudHmm,neither,0.03945320844208391,0.33037608806864915,0.630170703489267
shroudAFK shroudAFK shroudAFK shroudAFK shroudAFK shroudAFK,neither,0.03945320844208391,0.33037608806864915,0.630170703489267
shroudHype,neither,0.03945320844208391,0.33037608806864915,0.630170703489267
shroudHype shroudHype shroudHype shroudHype shroudHype shroudHype,neither,0.03945320844208391,0.33037608806864915,0.630170703489267
TableHere TableHere TableHere TableHere TableHere TableHere,neither,0.03945320844208391,0.33037608806864915,0.630170703489267
shroudHello shroudHello shroudHello shroudHello shroudHello shroudHello shroudHello shroudHello,neither,0.03945320844208391,0.33037608806864915,0.630170703489267
shroudR shroudR shroudR shroudR shroudR shroudR shroudR shroudR shroudR,neither,0.03945320844208391,0.33037608806864915,0.630170703489267
PogChamp,neither,0.03945320844208391,0.33037608806864915,0.630170703489267
shroudHello,neither,0.03945320844208391,0.33037608806864915,0.630170703489267
shroudHello shroudHello shroudHello shroudHello shroudHello,neither,0.03945320844208391,0.33037608806864915,0.630170703489267
shroud4Head shroud4Head shroud4Head shroud4Head shroud4Head shroud4Head shroud4Head,neither,0.03945320844208391,0.33037608806864915,0.630170703489267
shroudPigeon shroudPigeon shroudPigeon shroudPigeon shroudPigeon shroudPigeon shroudPigeon,neither,0.03945320844208391,0.33037608806864915,0.630170703489267
shroudMilk shroudMilk shroudMilk shroudMilk shroudMilk shroudMilk shroudMilk shroudMilk shroudMilk shroudMilk shroudMilk,neither,0.03945320844208391,0.33037608806864915,0.630170703489267
shroud is now live! Streaming Just Chatting: tryin to set this vr shit up | @shroud on socials,offensive_language,0.05641017988217965,0.9233098255365971,0.02027999458122324
shroudR shroudR shroudR shroudR shroudR shroudR,neither,0.03945320844208391,0.33037608806864915,0.630170703489267
shroudPalm shroudPalm shroudPalm,neither,0.03945320844208391,0.33037608806864915,0.630170703489267
shroudR shroudR shroudR,neither,0.03945320844208391,0.33037608806864915,0.630170703489267
Pog,neither,0.03945320844208391,0.33037608806864915,0.630170703489267
shroudFists shroudFists shroudFists shroudFists shroudFists shroudFists shroudFists,neither,0.03945320844208391,0.33037608806864915,0.630170703489267
Pog,neither,0.03945320844208391,0.33037608806864915,0.630170703489267
Bet,neither,0.03945320844208391,0.33037608806864915,0.630170703489267
shroudR shroudR shroudR shroudR shroudR,neither,0.03945320844208391,0.33037608806864915,0.630170703489267
shroudPalm shroudPalm shroudPalm shroudPalm shroudPalm shroudPalm shroudPalm shroudPalm shroudPalm shroudPalm shroudPalm shroudPalm shroudPalm shroudPalm shroudPalm shroudPalm shroudPalm shroudPalm,neither,0.03945320844208391,0.33037608806864915,0.630170703489267
Banned for show your bottom back,neither,0.07312612913611188,0.2387358936983288,0.6881379771655594
troyD troyDS troyJedi troyD troyDS troyJedi troyD troyDS troyJedi troyD troyDS troyJedi troyD troyDS troyJedi,neither,0.03945320844208391,0.33037608806864915,0.630170703489267
just9nRip just9nRip just9nRip just9nRip just9nRip just9nRip just9nRip just9nRip just9nRip just9nRip just9nRip just9nRip just9nRip just9nRip just9nRip just9nRip,neither,0.03945320844208391,0.33037608806864915,0.630170703489267
shroudHello shroudHello shroudHello shroudHello shroudHello shroudHello shroudHello,neither,0.03945320844208391,0.33037608806864915,0.630170703489267
shroudPigeon shroudPigeon shroudPigeon shroudPigeon shroudPigeon shroudMilk shroudMilk shroudMilk shroudMilk,neither,0.03945320844208391,0.33037608806864915,0.630170703489267
shroudPalm shroudPalm shroudPalm shroudPalm shroudPalm shroudPalm shroudPalm shroudPalm shroudPalm shroudPalm shroudPalm,neither,0.03945320844208391,0.33037608806864915,0.630170703489267
shroudHello shroudHello shroudHello shroudHello shroudHello shroudHello shroudHello shroudHello,neither,0.03945320844208391,0.33037608806864915,0.630170703489267
shroudTHICC shroudTHICC shroudTHICC shroudTHICC shroudTHICC shroudTHICC shroudTHICC shroudTHICC shroudTHICC shroudTHICC shroudTHICC shroudTHICC shroudTHICC,neither,0.03945320844208391,0.33037608806864915,0.630170703489267
Kidnapped by the Swedes,neither,0.03963901030875759,0.3607015571168242,0.5996594325744181
we back,neither,0.039166053543719236,0.33524985610846453,0.6255840903478163
we back Pog,neither,0.039166053543719236,0.33524985610846453,0.6255840903478163
shroudCHAIR,neither,0.03945320844208391,0.33037608806864915,0.630170703489267
shroud3 shroud3 shroud3 shroud3 shroud3,neither,0.03945320844208391,0.33037608806864915,0.630170703489267
does he even know,neither,0.027634320596679415,0.4854916377687806,0.48687404163453996
@shroud in expert mode you just need to click corners,neither,0.05169249388082586,0.3726039699306731,0.5757035361885011
wadu heck,neither,0.03945320844208391,0.33037608806864915,0.630170703489267
shroudPalm shroudPalm shroudPalm shroudPalm shroud200 shroudY,neither,0.03945320844208391,0.33037608806864915,0.630170703489267
PogU,neither,0.03945320844208391,0.33037608806864915,0.630170703489267
LOL,neither,0.020706217963973744,0.4882283491876925,0.4910654328483337
shroudHyper shroudHyper shroudHyper shroudHyper shroudHyper,neither,0.03945320844208391,0.33037608806864915,0.630170703489267
PogU living,neither,0.03945320844208391,0.33037608806864915,0.630170703489267
LUL LUL LUL LUL LUL,neither,0.03945320844208391,0.33037608806864915,0.630170703489267
shroudHmm shroudR shroudHmm shroudR shroudHmm shroudR shroudHmm shroudR shroudHmm shroudR,neither,0.03945320844208391,0.33037608806864915,0.630170703489267
shroudDoo shroudDoo shroudDoo shroudDoo shroudDoo shroudDoo shroudDoo shroudDoo,neither,0.03945320844208391,0.33037608806864915,0.630170703489267
"Get Shrouds custom blend ""Insane Roast"" or his Cold Brew Coffee ""INSANE CAPPUCCINO"" today - Use code ""SHROUD"" at checkout to get 40% off your Madrinas Coffee order (discount does not apply to the Shroud Coffeepack) shroudHype https://madrinascoffee.com/shroud shroudyC",neither,0.04455889795921978,0.30027310243824545,0.6551679996025347
Reload,neither,0.03945320844208391,0.33037608806864915,0.630170703489267
shroudR shroudR shroudR shroudR shroudR shroudR shroudR shroudR shroudR shroudR shroudR shroudR shroudR shroudR shroudR shroudR shroudR shroudR shroudR shroudR shroudR shroudR shroudR shroudR shroudR shroudR shroudR shroudR shroudR shroudR shroudR shroudR shroudR shroudR shroudR,neither,0.03945320844208391,0.33037608806864915,0.630170703489267
shroudPigeon shroudPigeon shroudPigeon shroudPigeon,neither,0.03945320844208391,0.33037608806864915,0.630170703489267
wb shroud and chat shroudH,neither,0.038434791122928746,0.27695075939240005,0.6846144494846712
shroud4Head shroud4Head shroud4Head shroud4Head shroud4Head shroud4Head,neither,0.03945320844208391,0.33037608806864915,0.630170703489267
shroud3 shroud3 shroud3 shroud3 shroud3,neither,0.03945320844208391,0.33037608806864915,0.630170703489267
he didnt even notice lol!,neither,0.036019285036102265,0.3899016864400727,0.5740790285238251
shroud4Head,neither,0.03945320844208391,0.33037608806864915,0.630170703489267
"hey chat, how was DayZ ? :)",neither,0.03933060715961675,0.33245695179596757,0.6282124410444158
neebsSMP1 neebsSMP2 neebsSMP3 neebsSMP1 neebsSMP2 neebsSMP3 neebsSMP1 neebsSMP2 neebsSMP3 neebsSMP1 neebsSMP2 neebsSMP3 neebsSMP1 neebsSMP2 neebsSMP3,neither,0.03945320844208391,0.33037608806864915,0.630170703489267
refresh,neither,0.03945320844208391,0.33037608806864915,0.630170703489267
shroud3 shroud3 shroud3 shroud3 shroud3 shroud3 shroud3 shroud3 shroud3 shroud3 shroud3 shroud3 shroud3 shroud3 shroud3 shroud3,neither,0.03945320844208391,0.33037608806864915,0.630170703489267
FIANLLY CLEANING YOUR FILTY ROOM I SEE LUL,neither,0.06224624996726627,0.32405571059928573,0.6136980394334479
shroudHype shroudHype,neither,0.03945320844208391,0.33037608806864915,0.630170703489267
monkaS,neither,0.03945320844208391,0.33037608806864915,0.630170703489267
lol,neither,0.020706217963973744,0.4882283491876925,0.4910654328483337
madamB madamFEET madamFEET madamFEET madamFEET,neither,0.03945320844208391,0.33037608806864915,0.630170703489267
LUL,neither,0.03945320844208391,0.33037608806864915,0.630170703489267
monkaS,neither,0.03945320844208391,0.33037608806864915,0.630170703489267
shroud1 shroud1 shroud1 shroud1 shroud1 shroud1 shroud1 shroud1 shroud1 shroud1,neither,0.03945320844208391,0.33037608806864915,0.630170703489267
Yayyyyyyyyy,neither,0.03945320844208391,0.33037608806864915,0.630170703489267
LMAO,neither,0.03705015143476208,0.3711622369619404,0.5917876116032975
We’re back bois!! shroudR,neither,0.05739049560341167,0.30475533920106856,0.6378541651955197
monkaW,neither,0.03945320844208391,0.33037608806864915,0.630170703489267
shroud3 shroud3 shroud3 shroud3 shroud3 shroud3 shroud3 shroud3 shroud3 shroud3 shroud3 shroud3 shroud3 shroud3 shroud3,neither,0.03945320844208391,0.33037608806864915,0.630170703489267
shroudTHICC shroudTHICC shroudTHICC shroudTHICC shroudTHICC shroudTHICC shroudTHICC shroudTHICC shroudTHICC shroudTHICC shroudTHICC shroudTHICC,neither,0.03945320844208391,0.33037608806864915,0.630170703489267
Pog,neither,0.03945320844208391,0.33037608806864915,0.630170703489267
shroudInsane,neither,0.03945320844208391,0.33037608806864915,0.630170703489267
shroudHmm,neither,0.03945320844208391,0.33037608806864915,0.630170703489267
monkaW,neither,0.03945320844208391,0.33037608806864915,0.630170703489267
shroudMilk shroudMilk shroudMilk shroudMilk,neither,0.03945320844208391,0.33037608806864915,0.630170703489267
LIFT WITH YOUR BACK,neither,0.053647086607583314,0.36051082916422833,0.5858420842281884
daniiCough daniiCough daniiCough daniiCough daniiCough daniiCough daniiCough daniiCough daniiCough daniiCough daniiCough daniiCough daniiCough daniiCough daniiCough daniiCough,neither,0.03945320844208391,0.33037608806864915,0.630170703489267
shoes monkaW,neither,0.03945320844208391,0.33037608806864915,0.630170703489267
we back,neither,0.039166053543719236,0.33524985610846453,0.6255840903478163
Please fall over Kappa,neither,0.03694312545010663,0.3319020763821163,0.6311547981677772
shroud4Head shroud4Head shroud4Head shroud4Head shroud4Head shroud4Head shroud4Head shroud4Head shroud4Head shroud4Head shroud4Head shroud4Head,neither,0.03945320844208391,0.33037608806864915,0.630170703489267
Check out Mike's Instagram account - http://www.instagram.com/shroud :D,neither,0.03410941730160631,0.30554211570058515,0.6603484669978086
monkaW,neither,0.03945320844208391,0.33037608806864915,0.630170703489267
shroud4Head shroud4Head shroud4Head shroud4Head,neither,0.03945320844208391,0.33037608806864915,0.630170703489267
shroudBlind shroudBlind shroudBlind,neither,0.03945320844208391,0.33037608806864915,0.630170703489267
shroudTHICC shroudTHICC shroudTHICC shroudTHICC shroudTHICC shroudTHICC shroudTHICC shroudTHICC shroudTHICC shroudTHICC,neither,0.03945320844208391,0.33037608806864915,0.630170703489267
https://clips.twitch.tv/BoringHedonisticWebChocolateRain,neither,0.03945320844208391,0.33037608806864915,0.630170703489267
HAHAHAHAHAHHAHAHAHAHAHAHA,neither,0.03945320844208391,0.33037608806864915,0.630170703489267
shroudTHICC shroudTHICC shroudTHICC shroudTHICC,neither,0.03945320844208391,0.33037608806864915,0.630170703489267
shroud4Head shroud4Head shroud4Head shroud4Head,neither,0.03945320844208391,0.33037608806864915,0.630170703489267
shroud4Head shroud4Head shroud4Head shroud4Head shroud4Head shroud4Head shroud4Head,neither,0.03945320844208391,0.33037608806864915,0.630170703489267
shroud4Head shroud4Head shroud4Head shroud4Head shroud4Head shroud4Head shroud4Head shroud4Head,neither,0.03945320844208391,0.33037608806864915,0.630170703489267
shroudInsane shroudInsane shroudInsane shroudInsane shroudInsane shroudInsane shroudInsane shroudInsane shroudInsane shroudInsane shroudInsane shroudInsane shroudInsane,neither,0.03945320844208391,0.33037608806864915,0.630170703489267
@shroud in expert mode you just need to click the 4 corners,neither,0.05061829004772364,0.3590152717502831,0.5903664382019933
DEM SKILLLZZZ,neither,0.03945320844208391,0.33037608806864915,0.630170703489267
Hi chat what did I miss????,neither,0.03775203562117902,0.32923244079448116,0.6330155235843399
Loft with your ass,offensive_language,0.20234490710420855,0.7976509014647055,4.191431085771402e-06
MercyWing1 shroud4Head MercyWing2,neither,0.03945320844208391,0.33037608806864915,0.630170703489267
Hold this shit j9,offensive_language,0.042652758752136685,0.9572506737712487,9.65674766145786e-05
That carpet needs to be cleaned,neither,0.041771961112663646,0.3630597337600752,0.5951683051272613
shroudPigeon,neither,0.03945320844208391,0.33037608806864915,0.630170703489267
shroudW 💨,neither,0.03945320844208391,0.33037608806864915,0.630170703489267
shroudPigeon shroudPigeon,neither,0.03945320844208391,0.33037608806864915,0.630170703489267
!uptime,neither,0.03945320844208391,0.33037608806864915,0.630170703489267
"@bunjake, Mike has been live for: 1 minute, 26 seconds",neither,0.03827032215155653,0.30952823393917506,0.6522014439092685
Got your workout for the day in,neither,0.05887915144716555,0.3063520047022248,0.6347688438506096
wtf,offensive_language,0.04410695246022759,0.7898861884776351,0.16600685906213722
time for meth,neither,0.03213604515442357,0.31970516737191074,0.6481587874736657
math,neither,0.03945320844208391,0.33037608806864915,0.630170703489267
trave like a pro,neither,0.05523543502272102,0.3524808385036451,0.5922837264736338
trace*,neither,0.03945320844208391,0.33037608806864915,0.630170703489267
what if troy walks in while you have the headset on?,neither,0.0355137615517647,0.40373556099152286,0.5607506774567124
"Socks are still in stock, Shroud EZ Shirts available - Limited quantity in size S. Mouse pads are out on Amazon now - type !mousepad in chat for more info - Classic Tees have been restocked, get them while you can! Use code 'SHROUD' for 10% off https://www.jinx.com/shroud shroudTHICC",neither,0.04158960228810873,0.34027492182678926,0.618135475885102
@galinskyy chill,neither,0.03945320844208391,0.33037608806864915,0.630170703489267
shroudDinner shroudDinner shroudDinner,neither,0.03945320844208391,0.33037608806864915,0.630170703489267
2.99 x 2.99,neither,0.03945320844208391,0.33037608806864915,0.630170703489267
moon walk pog shroudHype shroudHype shroudHype shroudHype,neither,0.03945320844208391,0.33037608806864915,0.630170703489267
shroudHype shroudHype shroudHype shroudHype shroudHype shroudHype,neither,0.03945320844208391,0.33037608806864915,0.630170703489267
wtf is happening,offensive_language,0.051020955935800125,0.5646961791071393,0.38428286495706065
Yeah,offensive_language,0.013968601452186464,0.5182923869769311,0.4677390115708824
It's like metal detecting,neither,0.05090626189213283,0.35065492282132876,0.5984388152865384
shroudTHICC shroudTHICC shroudTHICC shroudTHICC shroudTHICC shroudTHICC,neither,0.03945320844208391,0.33037608806864915,0.630170703489267
Subbed,neither,0.03945320844208391,0.33037608806864915,0.630170703489267
shroudL,neither,0.03945320844208391,0.33037608806864915,0.630170703489267
shroudPigeon,neither,0.03945320844208391,0.33037608806864915,0.630170703489267
lets go,neither,0.039984317429425154,0.35542799280679366,0.6045876897637812
yes,neither,0.03945320844208391,0.33037608806864915,0.630170703489267
LUL,neither,0.03945320844208391,0.33037608806864915,0.630170703489267
shroud has finally lost it.,neither,0.03838114363909144,0.32373651400432457,0.6378823423565839
here before 1 view,neither,0.08461290020994541,0.35552103651180156,0.5598660632782531
where the fuck i am,offensive_language,0.2176594759166525,0.7822169636075392,0.00012356047580830008
shroudHyper shroudHyper shroudHyper shroudHyper shroudHyper shroudHyper shroudHyper shroudHyper shroudHyper shroudHyper shroudHyper shroudHyper shroudHyper shroudHyper shroudHyper shroudHyper shroudHyper shroudHyper shroudHyper shroudHyper,neither,0.03945320844208391,0.33037608806864915,0.630170703489267
alexiaDerp,neither,0.03945320844208391,0.33037608806864915,0.630170703489267
PogU ?,neither,0.03945320844208391,0.33037608806864915,0.630170703489267
great content!,neither,0.03747316059443195,0.3039628757256895,0.6585639636798787
@92john meth,neither,0.03945320844208391,0.33037608806864915,0.630170703489267
shroudPigeon,neither,0.03945320844208391,0.33037608806864915,0.630170703489267
Hello shroud!,neither,0.03945320844208391,0.33037608806864915,0.630170703489267
VR??,neither,0.03945320844208391,0.33037608806864915,0.630170703489267
what's happening dacT,neither,0.04568673754512718,0.3259267583143808,0.628386504140492
shroudPigeon shroudPigeon shroudPigeon shroudPigeon shroudPigeon shroudPigeon,neither,0.03945320844208391,0.33037608806864915,0.630170703489267
What a salmon puncher,neither,0.045915666119560924,0.3257693565681219,0.6283149773123172
PogU,neither,0.03945320844208391,0.33037608806864915,0.630170703489267
lillexiHS lillexiHS lillexiHS,neither,0.03945320844208391,0.33037608806864915,0.630170703489267
FBPass shroudPigeon FBBlock shroud4Head,neither,0.03945320844208391,0.33037608806864915,0.630170703489267
what are you gonna play?,neither,0.12661798834207935,0.38186666506088307,0.49151534659703766
!uptime,neither,0.03945320844208391,0.33037608806864915,0.630170703489267
"@D2Storm, Mike has been live for: 2 minutes, 17 seconds",neither,0.038247129558412335,0.3090978536013409,0.6526550168402467
shroudW shroudW shroudW shroudW shroudW shroudW shroudW shroudW shroudW shroudW shroudW shroudW shroudW shroudW shroudW shroudW shroudW shroudW shroudW shroudW shroudW shroudW shroudW shroudW shroudW shroudW shroudW shroudW shroudW shroudW shroudW shroudW,neither,0.03945320844208391,0.33037608806864915,0.630170703489267
OUT OF SHAPE LUL,neither,0.03579828956940175,0.3443120623754265,0.6198896480551717
where did the 10k go,neither,0.04136905710846982,0.28986018185623585,0.6687707610352942
I love you shroud,offensive_language,0.079837142191777,0.5038574454704381,0.4163054123377849
LMAO,neither,0.03705015143476208,0.3711622369619404,0.5917876116032975
shroudPigeon shroudPigeon shroudPigeon shroudPigeon shroudPigeon shroudPigeon shroudPigeon shroudPigeon shroudPigeon shroudPigeon shroudPigeon shroudPigeon shroudPigeon shroudPigeon shroudPigeon shroudPigeon,neither,0.03945320844208391,0.33037608806864915,0.630170703489267
LUL,neither,0.03945320844208391,0.33037608806864915,0.630170703489267
HandsUp,neither,0.03945320844208391,0.33037608806864915,0.630170703489267
HandsUp,neither,0.03945320844208391,0.33037608806864915,0.630170703489267
;),neither,0.03945320844208391,0.33037608806864915,0.630170703489267
HandsUp,neither,0.03945320844208391,0.33037608806864915,0.630170703489267
What happened,neither,0.04722295797655572,0.3248777811305592,0.6278992608928851
rooGasm,neither,0.03945320844208391,0.33037608806864915,0.630170703489267
shroudHyper shroudHyper,neither,0.03945320844208391,0.33037608806864915,0.630170703489267
You have more cords than Rockefeller Center in NYC RN!,neither,0.05186674308688245,0.36884469071260245,0.579288566200515
ooo,neither,0.03945320844208391,0.33037608806864915,0.630170703489267
HandsUp,neither,0.03945320844208391,0.33037608806864915,0.630170703489267
I have a question,neither,0.038724831698251694,0.3427385423233071,0.6185366259784413
HandsUp,neither,0.03945320844208391,0.33037608806864915,0.630170703489267
??????????,neither,0.03945320844208391,0.33037608806864915,0.630170703489267
HandsUp,neither,0.03945320844208391,0.33037608806864915,0.630170703489267
@m3talf1sh hahahha,neither,0.03945320844208391,0.33037608806864915,0.630170703489267
on his knees HandsUp,neither,0.06804573726916216,0.3488943257696373,0.5830599369612006
@v_ness meth,neither,0.03945320844208391,0.33037608806864915,0.630170703489267
charity1000 Rift is better imo controllers are better #charity,neither,0.06475802667448322,0.29575013968530195,0.6394918336402148
LUL LUL LUL LUL LUL LUL LUL,neither,0.03945320844208391,0.33037608806864915,0.630170703489267
Mini Shroud,neither,0.03945320844208391,0.33037608806864915,0.630170703489267
It's ok shroudHyper,neither,0.036964990910480354,0.33268475953818333,0.6303502495513362
FailFish,neither,0.03945320844208391,0.33037608806864915,0.630170703489267
knees,neither,0.03945320844208391,0.33037608806864915,0.630170703489267
Boner,neither,0.03945320844208391,0.33037608806864915,0.630170703489267
openVR OBS plugin,neither,0.03945320844208391,0.33037608806864915,0.630170703489267
Give troy the VR on LUL,neither,0.03663416730923894,0.3281713962838334,0.6351944364069277
@v_ness tracing the boarder for VR PogU,neither,0.025530574474639644,0.23858405014631345,0.7358853753790469
KappaPride,neither,0.03945320844208391,0.33037608806864915,0.630170703489267
shroudMilk shroudMilk shroudMilk,neither,0.03945320844208391,0.33037608806864915,0.630170703489267
yeet,neither,0.03945320844208391,0.33037608806864915,0.630170703489267
sup,neither,0.03945320844208391,0.33037608806864915,0.630170703489267
Yes on your knees daddy,neither,0.0639576559254839,0.3350903757427049,0.6009519683318113
madamKRABS atl770SUS,neither,0.03945320844208391,0.33037608806864915,0.630170703489267
M3talf1sh oh,neither,0.051363287716059566,0.22255663153133606,0.7260800807526044
2,neither,0.03945320844208391,0.33037608806864915,0.630170703489267
@shroud did you know your stream went down 5 min ago?,neither,0.07458929035512418,0.3552671850104706,0.5701435246344052
