text,top_class,hate_speech,offensive_language,neither
but swiss neutrality has a reason,neither,0.035691681628305445,0.3342236769157337,0.630084641455961
!clock,neither,0.03945320844208391,0.33037608806864915,0.630170703489267
It is currently Wednesday 9:26 PM at the Geek & Sundry studio in California.,neither,0.051158870264843184,0.3296389382380525,0.6192021914971043
9:30pm Pacific time - TBD RPG - Prospect City Paranormal Part 2 (using the Weave system) .,neither,0.03600501017276483,0.37126727241157886,0.5927277174156563
you won't like swiss when they're angry :p,neither,0.07984604910451432,0.41559010257703893,0.5045638483184468
My brother visited your very pretty country and was a little stunned by the sticker shock.,neither,0.04953246802152278,0.36816591926524056,0.5823016127132368
I am SO hyped everyone!,neither,0.0338814461700619,0.4574706977286234,0.5086478561013147
Yay,neither,0.03945320844208391,0.33037608806864915,0.630170703489267
gandsClassic gandsHappy gandsFacepalm stefFremen,neither,0.03945320844208391,0.33037608806864915,0.630170703489267
Is there no way Europe can't ship more chocolate too us. I keep hearing how it's so much better than the local US stuff we are forced to accept.,neither,0.08729136309042126,0.30401622602427236,0.6086924108853063
sticker shock ???,neither,0.03945320844208391,0.33037608806864915,0.630170703489267
moin @KBTibbs,neither,0.03945320844208391,0.33037608806864915,0.630170703489267
Part of a two month european honeymoon,neither,0.039868872352238086,0.3233211867169704,0.6368099409307915
This whole situation sounds fishy,neither,0.039384599980768535,0.331540552710987,0.6290748473082445
WEAVE HYPE !!!,neither,0.03945320844208391,0.33037608806864915,0.630170703489267
"@CanHazBurritos well, switzerland isn't part of the EU so....",neither,0.03869324978331462,0.3509706437806485,0.6103361064360369
that's a new expression for me as well,neither,0.027924777562288366,0.3270866632994923,0.6449885591382194
price shock @gunheadx,neither,0.03945320844208391,0.33037608806864915,0.630170703489267
Hello @gunheadx,neither,0.03945320844208391,0.33037608806864915,0.630170703489267
@Time2Tabletop how goes?!,neither,0.03945320844208391,0.33037608806864915,0.630170703489267
but yeah our chocolate is good,neither,0.02720326678256214,0.4354342744969698,0.537362458720468
ah ok,neither,0.03938726060080474,0.3314953950453076,0.6291173443538877
price tag = sticker,neither,0.03945320844208391,0.33037608806864915,0.630170703489267
Hello 👋,neither,0.03945320844208391,0.33037608806864915,0.630170703489267
@swiftfingers it means suprise at the cost of things it comes from price tags in the US atleast often being stickers,neither,0.04921820795206964,0.32901484942843545,0.6217669426194948
animated so she is drawn or cg,neither,0.04909695581719297,0.4580323519054679,0.49287069227733915
I didn't watch this last week so I have no clue what's going on but fuck it. I just wanna chill and watch some RPG stuff with these fine ladies.,offensive_language,0.06945742270473908,0.8506350815753287,0.07990749571993225
"oh yeah, the prices are absolutely crazy",neither,0.03549589432488407,0.4103821402950821,0.5541219653800339
Yeet,neither,0.03945320844208391,0.33037608806864915,0.630170703489267
Belgian Chocolate is really good too though,neither,0.044640970373416744,0.33169606922628364,0.6236629604002997
goes great @anniedisaster09 ! just checking out some Weave and some Prospect City !!!,neither,0.024792379048958972,0.3298422743102459,0.6453653466407951
I did watch and still don't have a clue what's going on,neither,0.04242970069666017,0.34373182026883975,0.6138384790345001
JOEY LEMONS!,neither,0.03945320844208391,0.33037608806864915,0.630170703489267
Old Joe Lemon is... kinda gross.,neither,0.04508017818320576,0.3284407151465894,0.6264791066702047
@VermillionCrimson ask away. You may say I am a Prospect CIty expert ^_^,neither,0.05593640006249757,0.3277790599234952,0.6162845400140072
I just meant the continent in general has much better sweets. I have no clue to the quality of Swiss Chocolate.,neither,0.03703894743918182,0.33153915781735266,0.6314218947434657
"people think that because the main income is higher that everyone lives a golden life here, but the price of life is extremely high as well",neither,0.05907229116647026,0.44481434294554106,0.4961133658879886
let the madness start :D,neither,0.02487210568605288,0.34465123958490285,0.6304766547290442
TL;DW @anniedisaster09 ?,neither,0.03945320844208391,0.33037608806864915,0.630170703489267
If you say so @anniedisaster09 Kappa,neither,0.0338463710291165,0.4814720110227822,0.4846816179481013
Well that pencil mustache might be considered a fatal flaw. ;),neither,0.03762798769201359,0.354534129030674,0.6078378832773124
California (sorry late to the party),neither,0.06220682934853393,0.3077483250261146,0.6300448456253515
you're better off going to polynesia than switzerland for a honeymoon,neither,0.061191060571306216,0.33723621985794483,0.601572719570749
our hosts are some of the loveliest persons,neither,0.05094411847747868,0.2880534425683761,0.6610024389541452
"Well, they are in a paranoirmal style RPG, where they have managed to jump through a time portal from the Vegas town to its original iteration - an old timey Western town",neither,0.052038265659308074,0.2929891256653213,0.6549726086753705
We have a subscriber-only Discord server! Join here: https://discord.gg/geekandsundry (you'll need to sub and link it to your Twitch) and be a part of the fun!...Warning: It can take up to an hour for the server to update and give you access to the channels,neither,0.08464076273808444,0.286394834032893,0.6289644032290227
"well all but Becca, becca can sometimes be the worst",neither,0.03875799945206226,0.3687913544026434,0.5924506461452943
"if you're visiting friends though, it is indeed a beautiful country",neither,0.05421292550298161,0.3719000181937443,0.5738870563032741
I'm getting a Bioshock Infinite Colombia vibe.,neither,0.03598542733461489,0.3892333836499153,0.5747811890154698
Kinda-ish?,neither,0.03945320844208391,0.33037608806864915,0.630170703489267
especially in spring,neither,0.03945320844208391,0.33037608806864915,0.630170703489267
!shrodinger,neither,0.03945320844208391,0.33037608806864915,0.630170703489267
"Becca is Shrödinger's host, both the best and the worst, depending when you look",neither,0.04622660710471244,0.3218380172968208,0.6319353755984668
I just died @CanHazBurritos Thank You I needed that,neither,0.044159184127937394,0.4325554573893912,0.5232853584826713
Just from what Amy has said.,neither,0.041222078092894666,0.3238358235721263,0.6349420983349789
"Ah. Prospect City, Kansas. Got it",neither,0.03720133435843214,0.3695536425836396,0.5932450230579283
"Think Ghostbusters, meets Fallout New Vegas, Meets Disney Land",neither,0.041343647482052104,0.28577808215976147,0.6728782703581865
"Help G&S make great content! $4.99/month gets you emotes, Minecraft server access, sub-only VODs, and more! Every sub keeps the channel alive! twitch.tv/geekandsundry/subscribe",neither,0.043907990691603095,0.31135964332838284,0.644732365980014
Amy's using a lot of idioms tonight,neither,0.03446910615504342,0.3641396526618755,0.601391241183081
