text,top_class,hate_speech,offensive_language,neither
blackmagicka000 subscribed at Tier 1.,neither,0.03853807016957085,0.358210604756348,0.6032513250740811
Hello,neither,0.03945320844208391,0.33037608806864915,0.630170703489267
jcvimHi,neither,0.03945320844208391,0.33037608806864915,0.630170703489267
morfHi,neither,0.03945320844208391,0.33037608806864915,0.630170703489267
How's everyone's days going,neither,0.03198933125205076,0.45705756315075985,0.5109531055971893
5 player Smash? DansGame,neither,0.03363673253799751,0.4290968639534874,0.5372664035085151
not bad @ballicatter hope you're having an awesome day gandsGameEngine,neither,0.10935597632150228,0.23431079704672902,0.6563332266317686
Dr. Mario has a fake diploma.,neither,0.03977678837214363,0.3248840921792112,0.6353391194486452
Dr Mario hides his muscles with his big white coat,offensive_language,0.2929556114610668,0.5078108606013443,0.19923352793758892
Mario has a doctorate in not dealing with Bowser,neither,0.02797245755169399,0.36607768819527914,0.6059498542530268
trying to resub but I can't scroll down,neither,0.04241774899206181,0.3314883771715872,0.6260938738363511
any help with the prime sub thing?,neither,0.0310349236003218,0.34510916585851775,0.6238559105411605
!prime,neither,0.03945320844208391,0.33037608806864915,0.630170703489267
"If you have Amazon Prime or Amazon Prime Video, you can link your account to Twitch , and get Twitch Prime! This gives you one free Twitch subscription, and other cool stuff each month! Link your account at: twitch.amazon.com/prime - How to use the free subscription at: http://bit.ly/HowToSubWithTwitchPrime - REMEMBER: Subscriptions done through Twitch Prime will need to be manually renewed each month!",neither,0.04660741059459432,0.3340380786822325,0.6193545107231732
"Ok , I use my prime sub on another channel. I just want to renew G&S",neither,0.030059581241343433,0.4063187604994871,0.5636216582591694
Chatsworth in the house,neither,0.03803978903713722,0.3041033750396491,0.6578568359232138
!sub,neither,0.03945320844208391,0.33037608806864915,0.630170703489267
Help support the #GnSLive twitch channel! $4.99/month gets you exclusive sub-only benefits and helps keep the channel alive! Thanks! twitch.tv/geekandsundry/subscribe or for MOBILE https://secure.twitch.tv/products/geekandsundry/ticket/new,neither,0.047564760200365624,0.28780811278399754,0.6646271270156369
Many Thank Yous,neither,0.039045681467161995,0.3372928843937276,0.6236614341391103
I like how many pokemon there are now because you can just make up a name and people will believe it is a pokemon if you say it with conviction,neither,0.06597273397247233,0.37792539665450425,0.5561018693730235
Khaiden subscribed with Twitch Prime. They've subscribed for 3 months!,neither,0.017135853092050617,0.3228815153557895,0.6599826315521599
lavamon! @Andyinsomnia,neither,0.03945320844208391,0.33037608806864915,0.630170703489267
"grenkle is always in my party, just too powerful to remove y'know",neither,0.03614205955929688,0.43023302316327394,0.5336249172774292
how do I see the emotes pls? ><,neither,0.039973691581472355,0.3137650640092993,0.6462612444092283
oOSundogOo subscribed at Tier 1. They've subscribed for 75 months! gandsNatTwenty,neither,0.020894353282624248,0.31436957840503327,0.6647360683123426
click the smiley face on the right side of the chat box and either scroll down til you see geekandsundry emotes or type 'gands' in the search bar and they will show up if you are on desktop,neither,0.04870666075237303,0.32181129828166705,0.6294820409659599
gandsNatTwenty,neither,0.03945320844208391,0.33037608806864915,0.630170703489267
lol,neither,0.020706217963973744,0.4882283491876925,0.4910654328483337
no Nat in that one,neither,0.03406191678172202,0.41554610793105107,0.5503919752872269
gandsTwenty,neither,0.03945320844208391,0.33037608806864915,0.630170703489267
Bacon is a Sweet Dream tho :),neither,0.042416780571244615,0.33536718858098574,0.6222160308477697
"@Andyinsomnia TY, sir",neither,0.03945320844208391,0.33037608806864915,0.630170703489267
"you are welcome, enjoy your emotes and thanks for subbing gandsLessthanthree",neither,0.0917089088358524,0.2555157538284446,0.6527753373357029
Felicia FTW,neither,0.03945320844208391,0.33037608806864915,0.630170703489267
!wtfisthis,neither,0.03945320844208391,0.33037608806864915,0.630170703489267
"This is G&S Free Play, which is best described as a show on the Internet.",neither,0.05452218821345156,0.2976797892813506,0.647798022505198
!whodat,neither,0.03945320844208391,0.33037608806864915,0.630170703489267
"Whoever was available in the office, so this will likely not be super accurate so we're just going to put this here.",neither,0.06689770884075218,0.3490114396162654,0.5840908515429823
I wish a Prime sub would re-sub on it's own,neither,0.061041890768682834,0.314478366846178,0.624479742385139
Dang thing bounces around all my subscriptions,offensive_language,0.02756116105269594,0.5388299561611228,0.4336088827861811
yeah that would be a nice option to have,neither,0.027795459976810457,0.44463955091950463,0.5275649891036849
BigA2021 subscribed at Tier 1. They've subscribed for 38 months!,neither,0.02109000908695625,0.3145445573895783,0.6643654335234654
metroid,neither,0.03945320844208391,0.33037608806864915,0.630170703489267
chesterlegion subscribed with Twitch Prime. They've subscribed for 2 months!,neither,0.017135853092050617,0.3228815153557895,0.6599826315521599
Mystery and Bazooka are brother Joes,neither,0.06263496770622326,0.2521729142101452,0.6851921180836316
Un-Broken Denise,neither,0.03945320844208391,0.33037608806864915,0.630170703489267
Tri-fecta of Harness Racing,neither,0.03945320844208391,0.33037608806864915,0.630170703489267
Los Alamitos and Carmel,neither,0.03874382302275662,0.29488054638212113,0.6663756305951223
That was a f00kin great Hotel,neither,0.0339918435460033,0.34751710820168497,0.6184910482523118
Terra Cotta tiles and stucco,neither,0.03763944115734239,0.1918412352459551,0.7705193235967025
Harness Racing was so fun,neither,0.039297104534587256,0.3739374981633924,0.5867653973020204
LOL,neither,0.020706217963973744,0.4882283491876925,0.4910654328483337
Incorrect Grammar worthy of a red card,neither,0.03933303045912593,0.3293697331117406,0.6312972364291335
"sonicsanime44 subscribed at Tier 1. They've subscribed for 48 months, currently on a 48 month streak! Holy cow! That is all.",neither,0.027901429514502987,0.3646780920005619,0.6074204784849351
"Grats, Dude",neither,0.03945320844208391,0.33037608806864915,0.630170703489267
!whodat,neither,0.03945320844208391,0.33037608806864915,0.630170703489267
"Whoever was available in the office, so this will likely not be super accurate so we're just going to put this here.",neither,0.06689770884075218,0.3490114396162654,0.5840908515429823
This is an scalation of Stick Fight,neither,0.04808074862381641,0.323660870349068,0.6282583810271155
Hello,neither,0.03945320844208391,0.33037608806864915,0.630170703489267
