text,top_class,hate_speech,offensive_language,neither
and elmer's glue,neither,0.03854442882677734,0.28357035124239044,0.6778852199308323
"Sourdough is so good. Cuban bread is good, as is focaccia, rye, and French.",neither,0.05375387326332147,0.34316552988594384,0.6030805968507348
i have made plado,neither,0.03852918883816238,0.34605911224620095,0.6154116989156367
Yeaaaaaaah! XD,neither,0.03945320844208391,0.33037608806864915,0.630170703489267
"I was more of a paste fan, great minty taste, also the smell of fresh sheets from the Ditto machine",neither,0.03902396927869644,0.2926088428589768,0.6683671878623266
@The_TBoyce ..... do you like....bread? I've got a french loaf! *booff*.. goood byyyyy......,neither,0.03666751655048613,0.37848974968279125,0.5848427337667227
"I doubt I have ever eaten Play-Dough. I can remember everything up to age 2, and no Play-Dough eating.",neither,0.04012376953923418,0.33977720534678724,0.6200990251139785
*whisper calls* I love you.....,neither,0.052039344809216265,0.39006661421036065,0.5578940409804232
I've sniffed playdough.,neither,0.007688441738600854,0.2943591995657401,0.6979523586956591
^ Heh,neither,0.03945320844208391,0.33037608806864915,0.630170703489267
"Yeah, you don't need play dough, to make cookies...... you can just use real dough",offensive_language,0.02535280497469351,0.5285998591376224,0.44604733588768397
You can make cookies in the shape of giraffes or really any animal.,neither,0.049355380235874886,0.34489965053909133,0.6057449692250337
let them play with cookie dough,neither,0.027976170080570007,0.37756327523143884,0.5944605546879911
good job,neither,0.03847136223752934,0.3307137900015447,0.6308148477609259
Great job!,neither,0.03704547722858212,0.29796293611582825,0.6649915866555896
pretty sure we're all fine with that...,offensive_language,0.03573122534616819,0.5344309317941327,0.4298378428596992
"""You did it."" We really need an emote of Khail saying that. :D",neither,0.03954203906088549,0.409134864238804,0.5513230967003105
haha yes! I was always jealous of my friend that had the playdough masher toy thing.,neither,0.02746162338468956,0.46109239284403347,0.5114459837712769
"I forgot this was on, but I'm here now!",neither,0.07523713737019347,0.3198229594333983,0.6049399031964082
to make Hair....,neither,0.0498862103718931,0.32437722306378725,0.6257365665643198
Cadence of Hyrule: ASMR Edition,neither,0.03945320844208391,0.33037608806864915,0.630170703489267
Hi @PSWii2008,neither,0.03945320844208391,0.33037608806864915,0.630170703489267
"Gak, yeah... the wear moldable foam pellets",neither,0.024163379189955137,0.41713386835740784,0.558702752452637
"If this was Mines & Crafts and not Game Engine, they totally would do something with PlayDough next week :-D",neither,0.024370088794042462,0.34298182452578513,0.6326480866801725
gak was awesome!,neither,0.03928955873863454,0.3331536506278778,0.6275567906334877
"i had Legos, they tasted terrible",neither,0.03945320844208391,0.33037608806864915,0.630170703489267
"OK, so realness...... why do they make fruit flavored permanent markers?",neither,0.032913416686025765,0.36901122408243653,0.5980753592315377
"Alright, I've got to head over to the gym. Thanks for the stream, Khail, Erika, and Markeia!",neither,0.02472640457092176,0.30021908507679235,0.6750545103522859
"I love this game! And I love that one of my favorite streamers, Elspeth, plays Cadence! spethHype",neither,0.025124117125848763,0.39767269128881677,0.5772031915853344
Later @The_TBoyce,neither,0.03945320844208391,0.33037608806864915,0.630170703489267
Bye everyone! See you next week!,neither,0.045853207460160306,0.46897651704427185,0.48517027549556796
"Gak was toxic AF, wasn't it?",neither,0.03768260687554771,0.3333103613188034,0.6290070318056488
OMG I saw a recipe for slime pizza on good mthyical morning. It looked disgusting. lol,neither,0.03331390665756057,0.2731906837684912,0.6934954095739482
gak was toxic when it got warm,neither,0.026570556977373393,0.4355315384103502,0.5378979046122765
@The_TBoyce Later TB.. probably see you here or STS later,neither,0.08591164522178057,0.34688049851228925,0.5672078562659301
my gak strunk down into a hard booger.,offensive_language,0.02198712196941605,0.613891534896184,0.36412134313439987
"Lh_sabre subscribed at Tier 1. They've subscribed for 73 months, currently on a 4 month streak! Holy wow, 73 months of G&S",neither,0.025239996361961014,0.32479330749934854,0.6499666961386905
jcvimHi erika jcvimHi khail jcvimHi markia,neither,0.03945320844208391,0.33037608806864915,0.630170703489267
nice dude!,neither,0.03945320844208391,0.33037608806864915,0.630170703489267
ghosthack159 subscribed with Twitch Prime. They've subscribed for 16 months!,neither,0.018439317879319798,0.32324714782117564,0.6583135342995047
damn 73 i didnt know that was possible,offensive_language,0.041096764922831985,0.7618219383152681,0.1970812967618999
"hey, thanks for the reminder, my Prime was up",neither,0.025786315476525157,0.37478365282871423,0.5994300316947606
That's SOOO many months,neither,0.03582200734736647,0.36982705261019566,0.5943509400424378
I didn’t even know it was possible!,neither,0.025091599296711137,0.38557790573307804,0.589330494970211
"That can't be right, that's literally over SIX years",neither,0.03193159892734626,0.40326294821224956,0.5648054528604042
sounds right,neither,0.03814792326157206,0.35582766177656416,0.6060244149618638
Alpha months included,neither,0.03945320844208391,0.33037608806864915,0.630170703489267
alpha bonus :),neither,0.03945320844208391,0.33037608806864915,0.630170703489267
the channel is only FOUR years old,neither,0.04480842116921454,0.3161008852563883,0.6390906935743972
"Help G&S make great content! $4.99/month gets you emotes, Minecraft server access, sub-only VODs, and more! Every sub keeps the channel alive! twitch.tv/geekandsundry/subscribe",neither,0.043907990691603095,0.31135964332838284,0.644732365980014
I mean it’s what Twitch is telling me. I can’t do the math right now,neither,0.04163333642595221,0.3485815072563985,0.6097851563176493
RaitheFae subscribed with Twitch Prime. They've subscribed for 4 months!,neither,0.017135853092050617,0.3228815153557895,0.6599826315521599
math checks out,neither,0.035321314076554804,0.3462078122768597,0.6184708736465854
"wait, ALPHA is included?!",neither,0.0460676335569387,0.3281010839632016,0.6258312824798598
I don't think I got any credit for Alpha,neither,0.03424468618707469,0.3338305055321494,0.6319248082807759
Must be dem Alpha times,neither,0.040603012363429385,0.3204581268564803,0.6389388607800904
yeah me neither,neither,0.01752887135100429,0.4832027342265457,0.49926839442245
I don’t know how they got that number but sure!,offensive_language,0.02880518199242849,0.5093051849208153,0.4618896330867563
@ghosthack159 same but i only did a few there,neither,0.03704053533198991,0.30620179053630153,0.6567576741317085
"Lh, over here hacking Twitter to boost their rep ;P",neither,0.07315657105686024,0.38183718799522276,0.5450062409479172
I subbed the full time alpha was around.,neither,0.05083507499372872,0.3294713459780739,0.6196935790281973
no credit,neither,0.03833216230472147,0.3494031667169709,0.6122646709783076
@ghosthack159 says the one who is both a ghost and a hacker :P,neither,0.044138555920906083,0.3564125616419562,0.5994488824371377
I have cut down many trees with a slash of my sword and found absolutely no money.,neither,0.027893950978894282,0.3809645541377646,0.5911414948833411
<_<........,neither,0.03945320844208391,0.33037608806864915,0.630170703489267
.......>_>,neither,0.03945320844208391,0.33037608806864915,0.630170703489267
PROFESSIONAL ramaDance,neither,0.03945320844208391,0.33037608806864915,0.630170703489267
I was never here,neither,0.1101215002247253,0.33170534274746294,0.5581731570278118
*Smoke bomb*,neither,0.03538496010969857,0.39942487955132666,0.5651901603389747
Lol,neither,0.020706217963973744,0.4882283491876925,0.4910654328483337
depends on where the rupee shop is,neither,0.04444242210932317,0.2993070655711062,0.6562505123195708
Huzzah!,neither,0.03945320844208391,0.33037608806864915,0.630170703489267
"no but seriously, that 73 months anniversary is gonna bother me for awhile now",neither,0.03173043121775073,0.39024139909730715,0.5780281696849421
Oh geez I thought she said she got roofies. That wouldn’t be cool,neither,0.04426820971789177,0.4060654924060206,0.5496662978760877
"In the early channel days, I had the faster version of the G&S sub dance music as a notification tone ^^",neither,0.03810653800042704,0.31342374126343836,0.6484697207361347
I’m...sorry?,neither,0.03945320844208391,0.33037608806864915,0.630170703489267
Good job,neither,0.03847136223752934,0.3307137900015447,0.6308148477609259
"BlitheringBlatherskite subscribed at Tier 1. They've subscribed for 46 months, currently on a 46 month streak!",neither,0.02612277842873045,0.32511386983835716,0.6487633517329124
waves hi to all the lovely people,neither,0.06823267811947163,0.3623587178380446,0.569408604042484
Hi @shidareAKI,neither,0.03945320844208391,0.33037608806864915,0.630170703489267
"Evening, Aki",neither,0.03945320844208391,0.33037608806864915,0.630170703489267
roll the boulder,neither,0.03812050270363504,0.30567067662848607,0.6562088206678788
waves back at Aki,neither,0.038645261223836505,0.354963759940132,0.6063909788360315
how are we all doing today,neither,0.06807222781198537,0.33013257651841177,0.6017951956696029
Hey Markeia!,neither,0.03945320844208391,0.33037608806864915,0.630170703489267
WOW,neither,0.03945320844208391,0.33037608806864915,0.630170703489267
Toy Story forever coming for all our feels,neither,0.03631283696850926,0.352178868367995,0.6115082946634958
"That's damned near Spoilers, Markeia",neither,0.03567029904023788,0.3715037209056831,0.5928259800540789
it's gonna majorly wreck us all,neither,0.07722393812581044,0.43952131320644267,0.4832547486677469
#DED,neither,0.03945320844208391,0.33037608806864915,0.630170703489267
Tur Stury Fur,neither,0.03945320844208391,0.33037608806864915,0.630170703489267
:D,neither,0.03945320844208391,0.33037608806864915,0.630170703489267
Jessica A and Jessica B,neither,0.03891677997507931,0.30410338619963256,0.6569798338252881
"I only know Nayru, Din and Farore, but I haven't followed the series in a while.",neither,0.036086883642740576,0.29870566592380493,0.6652074504334544
Greek,neither,0.03945320844208391,0.33037608806864915,0.630170703489267
"Clotho, Lachesis and Atropos",neither,0.03763944115734239,0.1918412352459551,0.7705193235967025
Moire,neither,0.03945320844208391,0.33037608806864915,0.630170703489267
"Sorry, I thought you meant in game",neither,0.05697642674136981,0.23687476159781226,0.7061488116608179
"Not everything with a weird name is a Pokemon, Khail! ^^",neither,0.03515739589005848,0.3606503369914208,0.6041922671185207
"Romans had them too, called them Nona, Decuma, and Morta",neither,0.061112671967797336,0.29156390904814544,0.6473234189840572
we are proud of you,neither,0.1105699759182616,0.3288005555017394,0.560629468579999
"TBF there ARE over 800 species of Pokemon, so they MIGHT be Pokemon names",neither,0.048601213714107944,0.3123752318015186,0.6390235544843734
"Morta to Khail-Dad: ""I will end you.""",neither,0.07185476490003934,0.35000711577105426,0.5781381193289065
"Romanes Eunt Domum! (Sorry, my Inner Monty Python made me type that :-D )",neither,0.023848567518703942,0.4544816172193514,0.5216698152619448
Moreta or lessta?,neither,0.03945320844208391,0.33037608806864915,0.630170703489267
807,neither,0.03945320844208391,0.33037608806864915,0.630170703489267
"Urd, Verdani, Skuld, in Norse Mythology",neither,0.03945320844208391,0.33037608806864915,0.630170703489267
Yes! the Norns!,neither,0.03792693523346674,0.3018940506289838,0.6601790141375495
i looked it up 2 weeks ago,neither,0.03589985227503914,0.3779350128755762,0.5861651348493847
"lol IDK man, I stopped counting after Ruby/Sapphire Kappa",neither,0.035485335725593196,0.3901624941482449,0.5743521701261619
last one i played was.........yellow,neither,0.01058025076133863,0.036015139974966005,0.9534046092636953
I think I can´t even name 5 Pokemon.... never got into that franchise,neither,0.033740313009755975,0.41109472337480524,0.5551649636154388
"I can name 5, I play Smash",neither,0.039726468363622175,0.32573815404857787,0.6345353775878001
Pikachu... Mewtoo....,neither,0.03945320844208391,0.33037608806864915,0.630170703489267
That´s it,neither,0.02686667497728228,0.4382399667381754,0.5348933582845424
Do not know more by name,neither,0.042835455816189215,0.37341242180811857,0.5837521223756923
"Mew one, Pew-chu,",neither,0.038409750314396765,0.3686835454114124,0.5929067042741909
Ah pokemon.. I can get about 400+ in name..,neither,0.038194799079987574,0.35173457913015516,0.6100706217898573
!points @ghosthack159,neither,0.03945320844208391,0.33037608806864915,0.630170703489267
"That was an excellent pun, @ghosthack159! Here, have some points for that one! You have been awarded 34 points!",neither,0.05003766897837674,0.38201493930407926,0.5679473917175439
spells,neither,0.03945320844208391,0.33037608806864915,0.630170703489267
"Yeah, you'd think ""Mewtwo"" would have been a clue to one more...",neither,0.04014459084028673,0.4431819169963102,0.516673492163403
damage is really good,neither,0.04727053473566308,0.3276873510880799,0.625042114176257
I miss ocarina of time Fairys screaming at me,neither,0.02617665481262048,0.40673940337312936,0.56708394181425
I miss playing Pokemon.. it's been a few years.,neither,0.03348496697672682,0.3362367703816187,0.6302782626416543
Eh the last Zelda game I played was Hyrule Warriors on the Switch..,neither,0.03667541943114323,0.29977346249454484,0.6635511180743119
"Electrode, Diglett, Nidoran, Mankey. Venusaur, Rattata, Fearow, Pidgey!",neither,0.03945320844208391,0.33037608806864915,0.630170703489267
"Help G&S make great content! $4.99/month gets you emotes, Minecraft server access, sub-only VODs, and more! Every sub keeps the channel alive! twitch.tv/geekandsundry/subscribe",neither,0.043907990691603095,0.31135964332838284,0.644732365980014
Science is just magic to some people; so Khail just needs to go to an Erika house party & get the fairy party experience,neither,0.06146969232583979,0.29471465376319733,0.6438156539109628
"@ArisBranwin I liked Hyrule Warriors a lot, but I'm a Warriors nerd",neither,0.03777583240473912,0.33528441403057185,0.626939753564689
I enjoyed Pokemon Uranium!,neither,0.03945320844208391,0.33037608806864915,0.630170703489267
MTV awards were this last Sunday weren't they?,neither,0.03958656976325734,0.31823219325882784,0.6421812369779148
Movie awards,neither,0.04191274863921685,0.2886312720348843,0.6694559793258988
I play a lot of the warriors games too.. alas I have nobody to do WO4 on PS4 for..,neither,0.034267416389382924,0.39236478572722555,0.5733677978833915
I believe so,neither,0.039410295509965804,0.4047617245327211,0.5558279799573133
Lizzo is a treasure we do not deserve...,neither,0.05577151928409545,0.33081639461259643,0.6134120861033081
Mtv Awards were last night..,neither,0.03413126562034556,0.31445509647309394,0.6514136379065605
Bolder,neither,0.03945320844208391,0.33037608806864915,0.630170703489267
"They had Trixie Mattel, Katya, and Alyssa Edwards review the show.",neither,0.04918120342412278,0.23367131715826425,0.7171474794176129
On logo.,neither,0.03592414570432097,0.34743996012679706,0.616635894168882
I think they usually are. It's that Sunday of the month.,neither,0.05237183936603202,0.30960540196797764,0.6380227586659905
Is it HARD rock?,offensive_language,0.03628489968295518,0.556650866283434,0.4070642340336109
Rock the Beat in this area!,neither,0.03857897143669822,0.31731555338668,0.6441054751766218
Its just Rock and Roll.,neither,0.02939678921177856,0.31390046238012403,0.6567027484080974
!points @ghosthack159,neither,0.03945320844208391,0.33037608806864915,0.630170703489267
"That was an excellent pun, @ghosthack159! Here, have some points for that one! You have been awarded 33 points!",neither,0.049980789310414435,0.3817775744187309,0.5682416362708548
Now if that Rock monster had a rolling attack ^^,neither,0.02625469088170447,0.39054616683959537,0.5831991422787002
Waiting for my Rocking good time.,neither,0.02515048149744882,0.3882510313602059,0.5865984871423452
!points everyone,neither,0.03274051473645611,0.44430801898772593,0.5229514662758179
"That was an excellent pun, everyone! Here, have some points for that one! You have been awarded 14 points!",neither,0.04668245473502724,0.42216432398520304,0.5311532212797698
"I missed it, was it Octorok Music? Kappa",neither,0.037256883719061905,0.33264079637073,0.630102319910208
Have a seat in the Rocking chair!,neither,0.03840943616439138,0.3249527603956591,0.6366378034399495
"Boom Boom Boom Pop.... Boom Pop, sound of that rock beat",neither,0.03911487367241072,0.3285988914055233,0.6322862349220659
"Spear us the details, Khail!",neither,0.07197307414797909,0.31041111807990907,0.6176158077721118
"Found something interesting about the BOTW 2 trailer. If played in reverse then you can hear a whispering voice say ""Help us, please.""",neither,0.1174814855378919,0.3942579069368587,0.48826060752524947
Gotta love his song..,neither,0.06267110781704563,0.3890383338113136,0.5482905583716409
"@MissNayoung I read an article to that effect, but I heard something somewhat different.",neither,0.03908225676350427,0.3535074197183193,0.6074103235181764
"""This place sucks, the pots don't break.....""",neither,0.04093615039632208,0.2809409839973033,0.6781228656063747
@Zismarith Same here. I've heard various people say they heard something different each time.,neither,0.05736798254250641,0.31442848697575204,0.6282035304817416
"anyone who plays the necrodancer games.... do you have to press something to ""stay on the beat"" if you aren't moving?",neither,0.049031463488570425,0.4287759434032215,0.5221925931082081
"Okay, given that I am dogsitting again, and it´s 2.30 AM, I´m calling it a night, guess the dog will wake me up quite early.... Bye all!",neither,0.02988876088305459,0.38410177415806007,0.5860094649588853
A bombchu that eats goats. A Bombchupacabra Kappa,neither,0.036685847424716096,0.36032001781894996,0.6029941347563339
Later @Ossborn,neither,0.03945320844208391,0.33037608806864915,0.630170703489267
"@ghosthack159 Nope, you can stay still if you wish. Enemies will just get to keep going though.",neither,0.044501622816166354,0.4427649586262661,0.5127334185575674
!points @derekleeketchum,neither,0.03945320844208391,0.33037608806864915,0.630170703489267
"That was an excellent pun, @derekleeketchum! Here, have some points for that one! You have been awarded 21 points!",neither,0.05028957640842011,0.38306140444113307,0.5666490191504467
amydCheers @Ossborn,neither,0.03945320844208391,0.33037608806864915,0.630170703489267
oh my god I love this,neither,0.028772812478465224,0.3910743268908695,0.5801528606306653
"right right... I just know that you might want some timing adjustments to their patterns. wasn't sure if you could ""mess up the beat"" if you just stood still",offensive_language,0.030226265005064652,0.5465371033619145,0.4232366316330207
"I have no idea what's going on in the game, but I'm loving the music.",neither,0.035629491624059734,0.3288933867240026,0.6354771216519377
Push it in front of the stairs,neither,0.037562621875436596,0.3173754767167811,0.6450619014077823
@darkofnate you basically time your actions and movements to the beat of the music playing,neither,0.07620848734372104,0.3110847542725664,0.6127067583837126
THis makes me wish for a Hyrule LEgends sequel with Cadence from NEcrodancer as a playable character. I'd also want more obscure Zelda characters in it such as Veran and Onox from Oracle Of Ages and Oracle of Seasons.,neither,0.030415779337782032,0.32459377903567077,0.6449904416265472
I should say Hyrule Warriors.,neither,0.052881532065698504,0.3694695743026955,0.577648893631606
a new Hyrule Warriors game would be cool; i got the switch release of it last year and it was fun,neither,0.037884330294740406,0.26142776643659127,0.7006879032686681
I got you <3,offensive_language,0.0938950425311807,0.6237583852237704,0.28234657224504894
I like Hyrule Warriors.. I just need $$$ for the switch version.,neither,0.037856827733901977,0.3218656264158645,0.6402775458502334
!whodat,neither,0.03945320844208391,0.33037608806864915,0.630170703489267
"Erika Ishii ( twitter.com/ErikaIshii ), Khail Anonymous ( twitter.com/KhailAnonymous ), and Markeia McCarty ( twitter.com/markeiamccarty ).",neither,0.03824432162533281,0.4492197777120791,0.5125359006625881
Yeah and people have beaten it in a week.,neither,0.0407772608834142,0.3906349811610753,0.5685877579555105
"@MissNayoung The reversal I head seems to say ""Oh Zelda, oh please find the bodies."" Also some folks examined the symbols on the walls and the green smoke and lined them up with the Gerudo language.",neither,0.03817624541688895,0.26534517011350794,0.6964785844696031
"did anyone play the Fire Emblem musou game on the switch that came out like a year ago? it seems like nobody has made a musou game that fully utilizes current gen, as far as graphics and engine power goes",neither,0.03570472216811072,0.39067080463822285,0.5736244731936665
ruined,neither,0.03945320844208391,0.33037608806864915,0.630170703489267
@Zismarith I've also seen some folks bring up the Twili tribe from Twilight Princess. More specifically Zant.,neither,0.02365859734469155,0.32963690032017573,0.6467045023351328
Nebelbuer5te subscribed at Tier 1.,neither,0.03853807016957085,0.358210604756348,0.6032513250740811
Use the ball?,neither,0.009982080200001294,0.4225937905760032,0.5674241292239954
"@MissNayoung Ooh, tasty.",neither,0.03945320844208391,0.33037608806864915,0.630170703489267
the other 2,neither,0.03777723177055636,0.29892869000666566,0.6632940782227779
can you blow up the spikes,neither,0.05622160546857146,0.43552917111177913,0.5082492234196494
you need the left 2 in position,neither,0.053961398614168536,0.35489645847292833,0.5911421429129031
Said EVERY RPG character Markeia's ever played...,neither,0.03945320844208391,0.33037608806864915,0.630170703489267
You need the power glove,neither,0.052599065571705114,0.3527445371425857,0.5946563972857092
can you stack the cubes?,neither,0.051937437095460885,0.3484999218185638,0.5995626410859753
lol it is a real Loz thing,offensive_language,0.029365241819119203,0.5347836349485497,0.435851123232331
"one in that gap, one below the grey to stack from 1 behind the grey",neither,0.03942940008610486,0.35135047820857535,0.6092201217053199
Like items you havent unlocked,neither,0.06797833989254727,0.3905071216108272,0.5415145384966256
things cant be pulled can they?,neither,0.04010874859051481,0.3295914672377694,0.6302997841717158
The Power Glove is an actual item in Zelda games. Neat item too.,neither,0.042180170062091335,0.3224311856711694,0.6353886442667392
ohm shimmy it?,neither,0.037828236809968684,0.3309349903269868,0.6312367728630445
...... are we not doing phrasing?,neither,0.07389364260830902,0.27937087615225226,0.6467354812394387
gandsHR gandsHR gandsHR gandsHR gandsHR gandsHR,neither,0.03945320844208391,0.33037608806864915,0.630170703489267
!phrasing,neither,0.03945320844208391,0.33037608806864915,0.630170703489267
Danger Zoooooonnnneee!,neither,0.03945320844208391,0.33037608806864915,0.630170703489267
You can drag and lift the blocks over your head with the power glove,neither,0.05023951639201175,0.34124799487025564,0.6085124887377327
gandsHR gandsHR gandsHR gandsHR,neither,0.03945320844208391,0.33037608806864915,0.630170703489267
see erika gets it now,neither,0.03768246080346593,0.33098512938026975,0.6313324098162644
it doesnt need to go into the crevas,neither,0.044517744873796505,0.3137936826514085,0.641688572474795
(We've never done phrasing here.),neither,0.03913811808276703,0.33526181109253195,0.625600070824701
SO. MUCH. PHRASING.,neither,0.03263919147166354,0.4173937179957508,0.5499670905325856
It just needs to go in front of the chest,neither,0.039823290433772744,0.3343979013366119,0.6257788082296153
man down,neither,0.03975750337549435,0.4438453570415468,0.516397139582959
( @TheJerseyDriver that is a balled faced lie ),neither,0.04246524946501526,0.3610171739058882,0.5965175766290965
You all are becoming Blockheads?,neither,0.08469561818668496,0.3948704928126298,0.5204338890006852
All the phrasing plus all the character exertion sounds while I’m not watching is quite the experience,neither,0.04301936394206491,0.37625443833182426,0.5807261977261108
RIP,neither,0.03945320844208391,0.33037608806864915,0.630170703489267
Hehhehehhehehehhe,neither,0.03945320844208391,0.33037608806864915,0.630170703489267
redo,neither,0.03945320844208391,0.33037608806864915,0.630170703489267
slow clap,neither,0.03945320844208391,0.33037608806864915,0.630170703489267
Nooooooooo!!!!!,neither,0.03945320844208391,0.33037608806864915,0.630170703489267
The other side in the back.. thats where you do it.,neither,0.04724052114692408,0.3421934642795309,0.610566014573545
Between that hole,neither,0.035426994512445555,0.3741969012067689,0.5903761042807855
next time put it in the slot,neither,0.03610311238506349,0.34369243044496395,0.6202044571699725
the step needed to be in front,neither,0.04469645045737879,0.316344515406572,0.6389590341360493
you didn't have a barrier behind it,neither,0.03495651628550531,0.44875043416880867,0.516293049545686
https://clips.twitch.tv/KawaiiSmallEggnogDerp,neither,0.03945320844208391,0.33037608806864915,0.630170703489267
"You Push if you can't jump on it, you can only jump on it if you can't push it",neither,0.04277159078992046,0.4723818452479032,0.48484656396217635
