text,top_class,hate_speech,offensive_language,neither
"Hi Khail, Markeia and Erika!",neither,0.038358606956405694,0.2721397086643902,0.6895016843792041
thuluHEY hrpgHeyo Kail hrpgHeyo Markeia hrpgHeyo Erika,neither,0.03945320844208391,0.33037608806864915,0.630170703489267
tonykononny subscribed at Tier 1. They've subscribed for 16 months!,neither,0.020421538009370858,0.3139471505081261,0.6656313114825031
"Hello, everyone!",neither,0.03269494828970791,0.4450814005079928,0.5222236512022994
"sweet, got here right on time",neither,0.0755727909703822,0.38535779744610243,0.5390694115835153
Hi @momanonymous,neither,0.03945320844208391,0.33037608806864915,0.630170703489267
"Hello, @chaoticloony",neither,0.03945320844208391,0.33037608806864915,0.630170703489267
Zismarith subscribed with Twitch Prime. They've subscribed for 39 months!,neither,0.01898401742097586,0.3234084303717501,0.657607552207274
Yay Cadence of Hyrule!!!! So many amazing musicians who came up through YouTube and Twitch!,neither,0.0379248034467879,0.3900563618214812,0.5720188347317309
"I recently played Crypt myself for a couple of hours... unlocked the Bard, which means you do no langer need to care about the rythm ^^",neither,0.04546336321317406,0.3359815353906941,0.6185551013961319
The remixes also use some music from Crypt of the Necrodancer as well!!!,neither,0.016443754879067414,0.38854547207062823,0.5950107730503044
MrNY2Cali subscribed at Tier 1. They've subscribed for 23 months!,neither,0.020825380451553185,0.31430791656949075,0.664866702978956
@ossborn Cadence of Hyrule has fixed beat mode which mimics Bard.,neither,0.03973819429082369,0.3255391344617366,0.6347226712474398
Hehheheheheh,neither,0.03945320844208391,0.33037608806864915,0.630170703489267
"toy story 4, coming to a future kingdom hearts 4",neither,0.04342355518787599,0.32802628806189377,0.6285501567502303
"I beat Cadence of Hyrule story mode for the first time on Sunday...,",neither,0.02878706438181433,0.3235851541474135,0.647627781470772
I just want to see someone play it...,neither,0.03991579346862005,0.3444627630767371,0.6156214434546428
its erika,neither,0.02700859978372578,0.3346563596412867,0.6383350405749875
"Khail, you need to get a trip like that, for your family!",neither,0.09697844174545832,0.3789197434877361,0.5241018147668056
!points @momanonymous,neither,0.03945320844208391,0.33037608806864915,0.630170703489267
"That was an excellent pun, @momanonymous! Here, have some points for that one! You have been awarded 15 points!",neither,0.05033894095090745,0.3832655635051359,0.5663954955439566
Hahaha! I love points!,neither,0.03646646565574006,0.3442959053986495,0.6192376289456105
@ghosthack159 same,neither,0.04148851938089603,0.3488915597363099,0.609619920882794
Best day to go to the Magic Kingdom is during Dapper Days,neither,0.05405114327062515,0.30220978832066786,0.643739068408707
Not on someone else’s dime!,neither,0.03580549051919026,0.34689457070012963,0.6172999387806801
"""a long time ago""? Time to get new memories then and return there! :-D",neither,0.04320102743607568,0.2578740133214273,0.698924959242497
"half Cosplay, Half Americana Nostalgia",neither,0.03945320844208391,0.33037608806864915,0.630170703489267
Khail can you take your internet family to Disney World?,neither,0.0867574423479159,0.3491650511067897,0.5640775065452945
I am thinking about getting this for my daughter but wanted to see some gameplay,neither,0.023271421779496718,0.43349763089206084,0.5432309473284425
"Been a while since I last saw the words ""sweet"" and ""internet"" in the same sentence.",neither,0.03833974271693945,0.29777090015906305,0.6638893571239977
I am already loving this episode!,neither,0.038345962977753584,0.3465428120860925,0.6151112249361539
"I miss the old days of Disney season passes, when they were like 70 bucks..... you could just go in casually",neither,0.04037474011178206,0.3725857698098663,0.5870394900783517
"Thanks, Erika! gandsHype gandsHype gandsHype",neither,0.035884468650613,0.3004919205142699,0.6636236108351171
"Sociologygeek subscribed at Tier 1. They've subscribed for 68 months, currently on a 41 month streak!",neither,0.02239512321462605,0.3238220280209259,0.653782848764448
"We love you too, Erika!",neither,0.05987235140481781,0.439487593510106,0.5006400550850761
I'm fine never getting to the games :P,neither,0.037025175863936985,0.4100897298818826,0.5528850942541805
gandsGameEngine gandsGameEngine gandsGameEngine,neither,0.03945320844208391,0.33037608806864915,0.630170703489267
Are they going to play now? :D,neither,0.07919765833909213,0.3041050976122357,0.6166972440486722
Every odd odd number :-/,neither,0.03945320844208391,0.33037608806864915,0.630170703489267
"Ghost, of the line of Hack, 159th of his name.",neither,0.05441366153948107,0.3212854722665493,0.6243008661939696
"no, Erika.... It's Cadence",neither,0.03432144911607103,0.36487411038982576,0.6008044404941032
Who's Yennen? Kappa Keepo blackj6WUT,neither,0.0401687548053114,0.4035523871359183,0.5562788580587704
@Zismarith :P,neither,0.03945320844208391,0.33037608806864915,0.630170703489267
Shovel Knight,neither,0.03945320844208391,0.33037608806864915,0.630170703489267
That was the Necrodancer @geekandsundry,neither,0.03021399105932871,0.3864109461327129,0.5833750628079584
From Crypt of the Necrodancer,neither,0.039725164341985635,0.2648502299405368,0.6954246057174774
The guy with the golden lute is called Octavo,neither,0.0340720561850169,0.3393407611532845,0.6265871826616987
That too,neither,0.03126226639723697,0.423946830183124,0.544790903419639
Dude with the lite = Octavo,neither,0.022843034463481574,0.3628639189177851,0.6142930466187334
*lute,neither,0.03945320844208391,0.33037608806864915,0.630170703489267
"In other game related news, there was a new Sims 4 patch today, and it included some Pride month related stuff... clothing, some rainbow coloured leggings, T Shirt designs done together with the ""It Gets Better Project"", a selection of decorative Pride flags and a gender neutral bathroom door.",neither,0.0324710023961245,0.2731885724689885,0.694340425134887
"she's got the beat, she's got the beat, she's got the beat",offensive_language,0.0381949016636484,0.49311076707000695,0.46869433126634463
HEY,neither,0.03945320844208391,0.33037608806864915,0.630170703489267
LISTEN,neither,0.03945320844208391,0.33037608806864915,0.630170703489267
A Necrodancer cosplay... Would that person only do things when you made noises nearby? Kappa Keepo blackj6WUT,neither,0.039553984779606345,0.4069561742919454,0.5534898409284483
"Just finished this game yesterday, it’s so awesome 😁",neither,0.03456092785560174,0.3475337623871494,0.617905309757249
The music here is a mix of the main theme from Legend of Zelda and 1-1 from Crypt of the Necrodancer.,neither,0.061906193904228315,0.25843410386646726,0.6796597022293045
!points Erika,neither,0.03945320844208391,0.33037608806864915,0.630170703489267
"That was an excellent pun, Erika! Here, have some points for that one! You have been awarded 49 points!",neither,0.049980789310414435,0.3817775744187309,0.5682416362708548
"We still believe in you, Khail!",neither,0.059434665100841055,0.4134836483731043,0.5270816865260546
"And... Are they playing a MUSIC based games... With the sound almost on ""mute""? :D",neither,0.04206717149171809,0.3019773799175028,0.6559554485907791
Two player happens soon,neither,0.05267928205188823,0.39608670163147675,0.5512340163166349
You started a new file so you need to unlock co-op. @geekandsundry,neither,0.07709026920220592,0.36181501570557045,0.5610947150922235
erika was in the expansion,neither,0.037463223662604475,0.3016595415146285,0.6608772348227671
is this Star Lord's favorite game?,neither,0.04547280699061514,0.29498635484517344,0.6595408381642114
Get passed this first bit and you unlock 2 player mode,neither,0.0388181480143674,0.3953815234098735,0.5658003285757591
I guess they can hear it better than us,neither,0.06936313683497744,0.33232048658703717,0.5983163765779854
"Help G&S make great content! $4.99/month gets you emotes, Minecraft server access, sub-only VODs, and more! Every sub keeps the channel alive! twitch.tv/geekandsundry/subscribe",neither,0.043907990691603095,0.31135964332838284,0.644732365980014
I can hear it a LITTLE,neither,0.03767974832642851,0.33150916226786253,0.630811089405709
but it could be louder,neither,0.03552319213166619,0.34359232821396357,0.6208844796543702
"""Can chat hear everything ok?"" - Did anyone hear that? Kappa",neither,0.03753791254855048,0.35028661836601055,0.6121754690854389
The music is pretty low,neither,0.04683859242335529,0.31131284099448764,0.6418485665821572
i'm on headphones I can hear everything fine,neither,0.03744666389530195,0.3373110901243194,0.6252422459803787
(But yeah. A little louder would be nice. ),neither,0.025039802096013166,0.4223682367374445,0.5525919611665423
@Blackjungle308 :P,neither,0.03945320844208391,0.33037608806864915,0.630170703489267
There it goes.,neither,0.03745797801461688,0.27450367712496215,0.6880383448604208
"You're not Zelda... you're the character from the Necrodancer, transported into Hyrule",neither,0.0967409846958665,0.3152281538027638,0.5880308615013696
"""zelda AND sheik"". And me myself and Irene? Kappa",neither,0.034168295406888115,0.2864887577353784,0.6793429468577334
their name is cadence,neither,0.05187401684871951,0.32610400249395377,0.6220219806573266
Oooh. Cadence is a PERSON. Okaayy.,neither,0.047536970133134744,0.32759571173733376,0.6248673181295316
Necrodancer is the bad guy,neither,0.04363655983622639,0.3168991692228733,0.6394642709409003
@Zismarith it's like... a pun,neither,0.04979171782446044,0.34881253904586107,0.6013957431296784
"Cadence is how a music flows. (Lets confuse them, guys. Kappa )",neither,0.05166466565366558,0.3328154368004316,0.615519897545903
Yeah.,offensive_language,0.013968601452186464,0.5182923869769311,0.4677390115708824
!points Cadence,neither,0.03945320844208391,0.33037608806864915,0.630170703489267
"That was an excellent pun, Cadence! Here, have some points for that one! You have been awarded 76 points!",neither,0.049980789310414435,0.3817775744187309,0.5682416362708548
"Erika's voice is a higher pitch voice that she used when she GM'd Weave, many simulatorities",neither,0.037361873049066865,0.4501834154980246,0.5124547114529086
"it is okay Khail, you are still pretty",neither,0.10674741921060964,0.33762959677629917,0.5556229840130912
erika is the dlc,neither,0.04766640742991612,0.3094440240255625,0.6428895685445215
@danoba Tell Khalil if he wants a lore crash course to hit me up.,neither,0.027456603713628347,0.4272351043460452,0.5453082919403264
Khail,neither,0.03945320844208391,0.33037608806864915,0.630170703489267
Will do.,neither,0.0450026630396543,0.28390237408752217,0.6710949628728236
"Misses ALL the beats - ""Missed beat? That was kinda judgy..."" Kappa Keepo blackj6WUT",neither,0.03747193021199754,0.38485259685299833,0.577675472935004
stairs...?,neither,0.03945320844208391,0.33037608806864915,0.630170703489267
Wall at bottom right can be shovelled,neither,0.03856909896036797,0.366523643452064,0.5949072575875681
Waaaait. You have to respect the BEAT... in a DDR game?! Heresy! Lies! Kappa Keepo blackj6WUT,neither,0.05375942567598078,0.3205708256655883,0.6256697486584311
Zelda's face is priceless,neither,0.04608065237598881,0.32809660619434444,0.6258227414296668
"Guys.. When enimies are around, EVERYTHING has to be on the beat. Moving, attacking, items, etc. :)",neither,0.047122615404060264,0.32833588355712057,0.624541501038819
Three Vikings Shout out!,neither,0.03600689458600956,0.3434887893166758,0.6205043160973147
"Don't try these things at home, these are trained professionals! :)",neither,0.07745454785648091,0.4314508213698762,0.49109463077364296
"And the beat is TWICE the bpm you were saying ""beat, beat, beat"" to. :D",neither,0.04748058927580127,0.30453219350279576,0.6479872172214031
i need a Necrodancer level added to smash,neither,0.04465780041234145,0.326036273445941,0.6293059261417175
Hey Everyone TwitchUnity,neither,0.031959242684595296,0.4575682446653829,0.5104725126500218
"Gamers through the ages have wondered, ""does Zelda have rhythm?""",neither,0.03103162356592395,0.3999168874450336,0.5690514889890425
Hi @Leigh574,neither,0.03945320844208391,0.33037608806864915,0.630170703489267
hey @chaoticloony,neither,0.03945320844208391,0.33037608806864915,0.630170703489267
"Short awnser: As a rythmist, zelda is a GREAT archer. Kappa",neither,0.041610111811732124,0.33339625037825366,0.6249936378100143
Evening Leigh,neither,0.03945320844208391,0.33037608806864915,0.630170703489267
thuluHEY @Leigh574,neither,0.03945320844208391,0.33037608806864915,0.630170703489267
Hey @Leigh574,neither,0.03945320844208391,0.33037608806864915,0.630170703489267
Roguelikes are fun,neither,0.088328174310882,0.25595287300579694,0.655718952683321
Heh @Blackjungle308,neither,0.03945320844208391,0.33037608806864915,0.630170703489267
Hey @Ossborn @JeffM0307,neither,0.03945320844208391,0.33037608806864915,0.630170703489267
Hehhehehheheh,neither,0.03945320844208391,0.33037608806864915,0.630170703489267
Yes it’s a Zelda game with rogue like elements. Dungeon layout is randomized and over world map is randomized.,neither,0.04289610609049884,0.31382589390958315,0.6432779999999181
"Ah, the Castle music from A Link to the Past. Sweet.",neither,0.042900109121702446,0.29880312018186694,0.6582967706964306
How's audio now?,neither,0.03945320844208391,0.33037608806864915,0.630170703489267
I really love the boss music in this.,neither,0.035926019088623785,0.328983703674481,0.6350902772368953
I wouldn't change it.,neither,0.03773031704275527,0.33096866942510145,0.6313010135321432
Much better @danoba,neither,0.033464116335600605,0.3324360114774959,0.6340998721869036
"Works for me, thanks for the input everyone.",neither,0.022214135087234056,0.3769490265471068,0.600836838365659
!whodat,neither,0.03945320844208391,0.33037608806864915,0.630170703489267
"Erika Ishii ( twitter.com/ErikaIshii ), Khail Anonymous ( twitter.com/KhailAnonymous ), and Markeia McCarty ( twitter.com/markeiamccarty ).",neither,0.03824432162533281,0.4492197777120791,0.5125359006625881
you drop 1/2 in the water,neither,0.07309685004973712,0.35669937689707176,0.5702037730531913
"In stereo with the ""Ahhhhs""",neither,0.027660734521351652,0.35191525044600763,0.6204240150326408
This is actually a more forgiving game than Necrodancer,neither,0.046220498529912585,0.29585474317337623,0.6579247582967112
Yes headphones help,neither,0.03945320844208391,0.33037608806864915,0.630170703489267
"Hello Khail, Erika, and guest host Markeia! gandsGameEngine gandsGameEngine",neither,0.038831502437192376,0.29961486805145243,0.6615536295113552
There’s an item you can get that will grab items for you. ;),neither,0.05285255356012078,0.3459771274951559,0.6011703189447233
Hey @The_TBoyce,neither,0.03945320844208391,0.33037608806864915,0.630170703489267
That’s not Navi,neither,0.028304173764655688,0.4360860198108564,0.535609806424488
Hey @JeffM0307 ! Hello chat!,neither,0.03945320844208391,0.33037608806864915,0.630170703489267
Her name is Trill,offensive_language,0.037138390127828935,0.5506658787728936,0.4121957310992774
Hi @The_TBoyce,neither,0.03945320844208391,0.33037608806864915,0.630170703489267
@the_tboyce eogHey,neither,0.03945320844208391,0.33037608806864915,0.630170703489267
So how does this game work? You have to time the button presses?,neither,0.03968774865060624,0.44188686426830037,0.5184253870810933
At least it doesn't have permadeath,neither,0.03656710953661605,0.36620113590507325,0.5972317545583108
Think..... music beat matching game,neither,0.039283370163271464,0.2878484062400077,0.6728682235967208
@The_TBoyce,neither,0.03945320844208391,0.33037608806864915,0.630170703489267
@the_tboyce You move and attack to the beat when there are enemies. Otherwise it plays like Zelda.,neither,0.06278555398410833,0.30684569897999336,0.6303687470358983
"except ALL your actions and movements need to be done ""on the beat""",neither,0.0633181834565067,0.3470479269569761,0.5896338895865173
I believe in you all!,offensive_language,0.07320328946143649,0.5443251057169932,0.3824716048215704
Overworked and dungeon layouts are randomized each playthrough.,neither,0.06183337659357698,0.2543291593208185,0.6838374640856044
*overworld,neither,0.03945320844208391,0.33037608806864915,0.630170703489267
"@AxisOfAnarchy If you say so. I've never played a Zelda game, so I have to assume the mechanics *are* the same. :D",neither,0.03208838855598428,0.3812372946006808,0.5866743168433348
Zelda is an RPG with puzzle elements,neither,0.036268825129563226,0.3532903002024726,0.6104408746679643
If that helps.,neither,0.01931278536223582,0.4303472947139735,0.5503399199237905
This is a Killer game!,neither,0.04768922701620478,0.2840038976974861,0.668306875286309
"@AxisOfAnarchy I've heard of Zelda, I've just never played it myself. But thank you, though. :D",neither,0.017767928958391306,0.3690195634691802,0.6132125075724285
No problem. I play both games that this crosses so I try to help!,neither,0.040407208008327075,0.39741445631667033,0.5621783356750025
"I played the original Zelda, and i didn't find it very fun and haven't played any since",neither,0.03277991624228528,0.2672938638076826,0.6999262199500321
I mean... Ocarina of time,neither,0.03777843799188126,0.35880131341117116,0.6034202485969475
I’ve been playing Necrodancer since early access. My first Zelda game was Link’s Awakening .,neither,0.021670453471831986,0.3326158229563968,0.6457137235717713
"I got relatively late into video games, so I wasn't playing video games when I would have been in the Zelda age group.",neither,0.03805098146435242,0.3072318362565588,0.6547171822790888
Link’s Awakening is a good starter.,neither,0.04466934390806395,0.32858201989286395,0.6267486361990721
Not sure I'd call it an RPG.,neither,0.03102125594782249,0.4735745306862192,0.4954042133659583
"Zelda- A Link To The Past was my first one, back on the Super Nintendo",neither,0.030276168826700957,0.3806631484566245,0.5890606827166744
"eh, Tboyce.... it's not really an ""age group"" sort of thing... it's decidedly not a ""kids game""",neither,0.03644315615079599,0.31084471502444677,0.6527121288247573
Why not? You level up via hearts and gather items.,neither,0.040549387875142825,0.21645093030510415,0.7429996818197531
"@ghosthack159 Oh, interesting. There goes one assumption I had about Legend of Zelda. :)",neither,0.04094749539894261,0.3100093742467008,0.6490431303543567
"no suggestions for Wand of Gamelon, eh?",neither,0.033902284367372575,0.31715194334980096,0.6489457722828265
FTL is probably my favorite Roguelike,neither,0.032816291243165846,0.4461415313883319,0.5210421773685023
"One game I really thought about playing because it looked a bit darker was ""Twilight Princess""? Any thoughts on that game?",neither,0.03574702471140958,0.3007457447308231,0.6635072305577673
FTL... I never managed to beat it.... nowadays I play a lot Dead Cells,neither,0.03995604720685755,0.35438153921516174,0.6056624135779808
"granted, @The_TBoyce it's not a 'gritty ADULT game"", but it's not ""for kids"".... in the same way that Mario games are not ""kids"" games.",neither,0.03942750589550498,0.30687503509898834,0.6536974590055068
@The_TBoyce Twilight princess is a solid choice.,neither,0.04601025097635132,0.32812082046397834,0.6258689285596702
"@AxisOfAnarchy Hmm. 50/50 on the non-traditional leveling. Real time combat. But mostly that Link doesn't really change throughout the game, or even the series. No character . . . anything.",neither,0.03165361777254969,0.37876343295201953,0.5895829492754306
I need to start a 2nd playthrough.,neither,0.046536630598665064,0.32454665462315624,0.6289167147781788
you did it,neither,0.07166810242296817,0.42882795882198005,0.4995039387550518
"@Ossborn I beat it a couple of times, and it was so enjoyable but i played it probably 500 times",neither,0.03479746926567438,0.3477908913620396,0.6174116393722859
"Oh, Khail...that hits too close to home. :D",neither,0.04583103362475101,0.32419692882326395,0.629972037551985
"Character development is a very recent phenomenon in RPGs. The original FF had no character development, same with Dragon Warrior.",neither,0.037685596548501996,0.34353475893971,0.618779644511788
That is true.,neither,0.045422752526274854,0.38723307181673444,0.5673441756569907
I also enjoyed the Pokemon Mystery Dungeon games and Angband with its so many versions,neither,0.029545607187990586,0.3440755858480964,0.626378806963913
I wonder if people who are really good at BeatSaber would be just as good at this game?,neither,0.04850864100115429,0.4060879213911319,0.5454034376077138
Lost Woods theme eogAhh,neither,0.03945320844208391,0.33037608806864915,0.630170703489267
ask Erika ;P :D,neither,0.03945320844208391,0.33037608806864915,0.630170703489267
Not my top fave track but a great one nonetheless,neither,0.027239813909424357,0.40101805797141776,0.5717421281191579
"Thanks, KhailDad! gandsGameEngine",neither,0.035884468650613,0.3004919205142699,0.6636236108351171
Bomb trap,neither,0.03945320844208391,0.33037608806864915,0.630170703489267
Ring of Risk: +3 to any strategy-based tabletop checks.,neither,0.04330953167873888,0.3280925127446826,0.6285979555765786
"Ring of Risk: The game now lasts for 60 days, but the last 10 days are just you trying to hang onto papua new ginea",neither,0.05230116064030985,0.26084212669864737,0.6868567126610428
!points @ghosthack159,neither,0.03945320844208391,0.33037608806864915,0.630170703489267
"That was an excellent pun, @ghosthack159! Here, have some points for that one! You have been awarded 24 points!",neither,0.05037983996645441,0.3834344862531679,0.5661856737803777
"@ghosthack159 LOL, it me, but with Axis & Allies. :D",neither,0.01755719681428834,0.4528216595440507,0.5296211436416608
@The_TBoyce have you tried the A&A&Zombies?,neither,0.05342118504522836,0.3653031865028207,0.5812756284519509
"""You did it."" - the Internet's dad",neither,0.052799222065125086,0.35811441068909167,0.5890863672457832
you have accomplished so much.,offensive_language,0.05774940014085703,0.5084743374038102,0.43377626245533274
i am very proud,neither,0.039246986884235543,0.33044701711880703,0.6303059959969576
"@ghosthack159 No, but I've heard of it. Truth be told, I've been brainstorming a World War Z-style D&D campaign.",neither,0.0172441336751253,0.3267080484363066,0.6560478178885681
I've been trying to construct a contemporary setting for DnD... where you could have a zombie apocalypse due to necromancers,neither,0.03591157084229497,0.3136736600465143,0.6504147691111907
"""We were making headway."" But how much does a headway?",neither,0.02364398320466618,0.4269253757016306,0.5494306410937031
!points @The_TBoyce,neither,0.03945320844208391,0.33037608806864915,0.630170703489267
"That was an excellent pun, @The_TBoyce! Here, have some points for that one! You have been awarded 85 points!",neither,0.050107313171023064,0.38230503055647863,0.5675876562724983
about 4 lpbs,neither,0.03510642987957868,0.4041522644624374,0.5607413056579837
lbs,neither,0.03945320844208391,0.33037608806864915,0.630170703489267
"@ghosthack159 Basically. Necromancers would have so much fun in World War Z. ""Yay! More thralls!"" :D",neither,0.03736321377437676,0.35471182990001876,0.6079249563256045
Do you lose health if you miss a beat? What are the consequences?,neither,0.06018968213926572,0.3837443002016783,0.5560660176590559
You just don't get to move,neither,0.06326471144216042,0.42303768204302655,0.5136976065148132
"I donno why, but in my head canon... Necromancers are like... the D-students at wizard school.... that's why they always run-amok and why it always ""goes wrong""..... only chump wizards try to raise the dead.",neither,0.030306214480711736,0.40773756445819814,0.5619562210610901
:P,neither,0.03945320844208391,0.33037608806864915,0.630170703489267
"@エクセル Okay, so it's like, ""paralyzed for a turn"", basically? So the enemy has a chance to attack or move?",neither,0.04357409032711805,0.3533630970156669,0.603062812657215
"There's also a mode that turns of the rhythm part and just makes it a old-school rogue movement, where everything just waits for you to move",neither,0.03916721802627855,0.31451166139520814,0.6463211205785132
"@The_TBoyce yeah, sort of... think of it more like.... a turn based game, but the turns are the beat",neither,0.04316494228952253,0.33220014001130677,0.6246349176991707
"@ghosthack159 Hey! Saruman dabbled in the fell arts of the Dark Lord, and he was called ""the Wise""! :D",neither,0.03873162090298929,0.31566613258380855,0.6456022465132022
"@ghosthack159 Right, a turn-based game.",neither,0.03795469172480527,0.3080286606196912,0.6540166476555036
"yeah, right up until he fell... then he became... Le Chump",neither,0.03182299026727184,0.4476136048100276,0.5205634049227005
"Dang it, now I want a pretzel...",neither,0.03748616472935885,0.32453508688310073,0.6379787483875403
"Hot take, Pretzel rolls are over rated..... Soft Pretzels are amazing though",neither,0.06803222355562061,0.2788991639320115,0.653068612512368
"Yes, we know what a pretzel bun looks like...",neither,0.05320583317500197,0.34171025069146715,0.6050839161335309
"OMG, King's Hawaiian is the best!",neither,0.044255762008489075,0.3104599299448633,0.6452843080466476
Sour Dough is amazing.... PBnJ on sourdough toast.... Clam chowder in a sour dough bowl.... crutons....,neither,0.04243087385687739,0.29608110729432036,0.6614880188488023
It's because of the salt...,neither,0.03708521536245564,0.3140775445366854,0.6488372401008589
Definitely eaten playdough,neither,0.03945320844208391,0.33037608806864915,0.630170703489267
